{
  "contentVersion": 1,
  "minClientVersion": 1,
  "updatedAt": "2026-09-28",
  "notice": null,
  "season": {
    "id": "newyear-2027",
    "title": "새해 만다라트",
    "from": "2026-12-15",
    "to": "2027-01-31",
    "message": "새해 목표를 만다라트로 그려 보세요"
  },
  "templates": [
    {
      "id": "healthy-year",
      "title": "건강한 한 해",
      "goal": "올해는 몸과 마음이 건강한 한 해",
      "subs": [
        {
          "title": "규칙적인 수면",
          "actions": [
            "밤 12시 전에 자기",
            "아침 7시에 일어나기",
            "자기 전 휴대폰 멀리 두기",
            "주말에도 기상 시간 지키기",
            "카페인은 오후 2시까지",
            "잠들기 1시간 전 조명 낮추기",
            "낮잠은 20분 안에",
            "수면 시간 기록하기"
          ]
        },
        {
          "title": "꾸준한 운동",
          "actions": [
            "주 3회 30분 걷기",
            "주 2회 근력 운동",
            "3층까지는 계단으로",
            "매일 스트레칭 10분",
            "한 달에 한 번 등산",
            "운동 기록 남기기",
            "같이 운동할 친구 만들기",
            "한 달에 한 번 체력 점검"
          ]
        },
        {
          "title": "균형 잡힌 식사",
          "actions": [
            "아침 거르지 않기",
            "매 끼 채소 한 접시",
            "물 하루 1.5리터",
            "야식은 주 1회 이하",
            "배달 음식은 주 2회 이하",
            "20분 이상 천천히 먹기",
            "단 음료 줄이기",
            "장보기 목록 미리 쓰기"
          ]
        },
        {
          "title": "마음 돌보기",
          "actions": [
            "하루 5분 명상",
            "감사한 일 세 가지 적기",
            "주 1회 좋아하는 취미",
            "힘든 날은 일찍 쉬기",
            "SNS 는 하루 30분 안에",
            "산책하며 생각 정리",
            "한 달에 책 한 권",
            "고민은 글로 적어 보기"
          ]
        },
        {
          "title": "건강 검진과 관리",
          "actions": [
            "연 1회 건강검진 받기",
            "치과 정기 검진",
            "체중과 혈압 월 1회 기록",
            "영양제 챙겨 먹기",
            "50분마다 눈 쉬기",
            "바른 자세로 앉기",
            "손 자주 씻기",
            "예방접종 일정 확인"
          ]
        },
        {
          "title": "사람과의 관계",
          "actions": [
            "가족에게 주 1회 안부",
            "친구와 월 1회 만나기",
            "고마움은 바로 말하기",
            "먼저 듣기",
            "약속 시간 지키기",
            "새로운 모임 하나 참여",
            "부탁은 정중히 거절도 하기",
            "가까운 사람 생일 챙기기"
          ]
        },
        {
          "title": "일과 쉼의 균형",
          "actions": [
            "퇴근 후 업무 알림 끄기",
            "주말 하루는 완전히 쉬기",
            "휴가 미리 계획하기",
            "점심시간에 산책",
            "오늘 할 일은 세 가지만",
            "늦게까지 일하는 날은 주 1회 이하",
            "취미 시간 따로 두기",
            "한 달에 한 번 혼자 여행"
          ]
        },
        {
          "title": "습관 정리하기",
          "actions": [
            "군것질 줄이기",
            "탄산음료 대신 물",
            "늦은 밤 간식 끊기",
            "큰 지출은 하루 생각하고",
            "침대에서 휴대폰 안 보기",
            "미루지 말고 5분만 시작",
            "험담 줄이기",
            "잘못은 바로 사과하기"
          ]
        }
      ]
    },
    {
      "id": "job-change",
      "title": "이직 준비",
      "goal": "6개월 안에 원하는 회사로 이직하기",
      "subs": [
        {
          "title": "목표 회사 정하기",
          "actions": [
            "관심 회사 10곳 목록 만들기",
            "채용 공고 주 1회 확인",
            "필요한 역량 정리하기",
            "연봉과 복지 기준 정하기",
            "현직자 인터뷰 글 읽기",
            "회사 문화 조사하기",
            "지원 일정 달력에 표시",
            "우선순위 3곳 확정"
          ]
        },
        {
          "title": "이력서와 포트폴리오",
          "actions": [
            "이력서 최신으로 고치기",
            "성과를 숫자로 적기",
            "포트폴리오 3개 정리",
            "자기소개 3줄 준비",
            "지인에게 피드백 받기",
            "오탈자 점검",
            "회사별로 맞춤 수정",
            "링크 하나로 모으기"
          ]
        },
        {
          "title": "역량 키우기",
          "actions": [
            "부족한 기술 하나 정하기",
            "주 5시간 학습",
            "온라인 강의 1개 끝내기",
            "사이드 프로젝트 시작",
            "학습 기록 남기기",
            "자격증 일정 확인",
            "스터디 참여",
            "월 1회 결과물 공유"
          ]
        },
        {
          "title": "면접 준비",
          "actions": [
            "예상 질문 30개 쓰기",
            "답변 소리 내어 연습",
            "모의 면접 2회",
            "경험을 상황·행동·결과로 정리",
            "회사별 질문 준비",
            "복장과 준비물 점검",
            "면접 뒤 회고 기록",
            "감사 메일 보내기"
          ]
        },
        {
          "title": "사람 만나기",
          "actions": [
            "업계 모임 월 1회",
            "프로필 페이지 정리",
            "전 동료와 연락하기",
            "멘토 한 명 만들기",
            "추천서 부탁할 분 정하기",
            "온라인 커뮤니티 활동",
            "연락처 정리",
            "도움받으면 감사 표현"
          ]
        },
        {
          "title": "지금 일 마무리",
          "actions": [
            "인수인계 문서 준비",
            "진행 중 업무 정리",
            "성과 자료 규정 안에서 정리",
            "퇴사 절차 확인",
            "남은 연차 계획",
            "동료와 좋은 관계 유지",
            "마지막 날까지 성실히",
            "퇴직 서류 챙기기"
          ]
        },
        {
          "title": "돈 준비",
          "actions": [
            "비상금 3개월치 모으기",
            "공백 기간 예산 세우기",
            "고정 지출 점검",
            "퇴직금 확인",
            "건강보험 전환 알아보기",
            "안 쓰는 구독 해지",
            "이직 축하 예산 정하기",
            "가계부 매주 확인"
          ]
        },
        {
          "title": "컨디션 관리",
          "actions": [
            "주 3회 운동",
            "취침 시간 지키기",
            "면접 전날 일찍 자기",
            "스트레스 기록하기",
            "주말 하루 쉬기",
            "가족과 계획 나누기",
            "작은 성공 축하하기",
            "떨어져도 다시 지원하기"
          ]
        }
      ]
    }
  ],
  "cheers": [
    "오늘도 한 칸 채웠어요",
    "작은 실천이 쌓이고 있어요",
    "어제보다 한 걸음 더 왔어요",
    "꾸준함이 목표를 가까이 데려와요",
    "오늘 한 일이 내일의 힘이 돼요",
    "체크 하나가 하루를 바꿔요",
    "잘하고 있어요, 이대로 가요",
    "멈추지 않는 게 가장 큰 재능이에요",
    "오늘의 실천을 기록했어요",
    "한 주가 조금씩 채워지고 있어요",
    "오늘은 쉬어도 괜찮아요, 내일 다시 해요",
    "계획을 다시 본 것만으로 충분해요",
    "한 칸씩, 천천히, 확실하게",
    "목표에 하루만큼 더 가까워졌어요",
    "기록이 쌓이면 길이 보여요",
    "오늘의 나에게 수고했다고 말해요",
    "실천한 나를 믿어요",
    "작지만 분명한 변화예요",
    "다음 체크도 여기서 만나요",
    "좋은 하루를 만들었어요"
  ]
}
